{
  "schema": "specmetry.init/v1",
  "project": {
    "id": "01J9Z3K5Q8R2T4V6W8X0Y2Z4C1",
    "name": "demo",
    "stage": "docs_only",
    "stage_detected": "in_development"
  },
  "created": false,
  "init_progress": "baseline_confirmed",
  "baseline_version": 2,
  "target": null,
  "candidate_sources": ["docs/client-brief.md", "README.md"],
  "test_hints": ["go test ./..."],
  "warnings": ["detached_head_no_target"]
}
